{
  "schemaVersion": 1,
  "scenarioId": "scene.comfort.cold.v1",
  "version": 1,
  "supportedSources": ["HMI_BUTTON", "VOICE", "API"],
  "supportedZones": ["ROW1_DRIVER", "ROW1_PASSENGER"],
  "contextPolicyId": "context.seat-comfort.v1",
  "requiredContext": [
    "Vehicle.Speed",
    "Vehicle.Powertrain.Transmission.CurrentGear",
    "Vehicle.Chassis.ParkingBrake.IsEngaged",
    "Vehicle.Cabin.Seat.IsOccupied"
  ],
  "optionalContext": [
    "Vehicle.Cabin.HVAC.IsAirConditioningActive",
    "Vehicle.Cabin.HVAC.AmbientAirTemperature",
    "Vehicle.Cabin.Seat.Heating"
  ],
  "requiredCapabilities": [
    "vehicle.hvac.power",
    "vehicle.hvac.target_temperature"
  ],
  "optionalCapabilities": ["vehicle.seat.heating"],
  "riskClass": "MEDIUM",
  "planTemplate": {
    "nodes": [
      {
        "nodeId": "capture_context",
        "nodeType": "context.capture",
        "capabilityId": "",
        "required": true,
        "timeoutMs": 1000,
        "maxAttempts": 1,
        "idempotencyKeyTemplate": "",
        "compensationNodeId": "",
        "policy": {
          "policyId": "policy.context.capture.v1",
          "policyVersion": 1,
          "riskClass": "LOW",
          "drivingPolicy": "ANY",
          "approvalRequired": false,
          "failureMode": "FAIL_SCENARIO"
        }
      },
      {
        "nodeId": "evaluate_policy",
        "nodeType": "policy.evaluate",
        "capabilityId": "",
        "required": true,
        "timeoutMs": 1000,
        "maxAttempts": 1,
        "idempotencyKeyTemplate": "",
        "compensationNodeId": "",
        "policy": {
          "policyId": "policy.comfort.cold.v1",
          "policyVersion": 1,
          "riskClass": "LOW",
          "drivingPolicy": "ANY",
          "approvalRequired": false,
          "failureMode": "FAIL_SCENARIO"
        }
      },
      {
        "nodeId": "set_hvac_power",
        "nodeType": "effect.execute",
        "capabilityId": "vehicle.hvac.power",
        "required": true,
        "timeoutMs": 5000,
        "maxAttempts": 2,
        "idempotencyKeyTemplate": "scene.cold.hvac_power",
        "compensationNodeId": "",
        "policy": {
          "policyId": "policy.hvac.power.v1",
          "policyVersion": 1,
          "riskClass": "LOW",
          "drivingPolicy": "ANY",
          "approvalRequired": false,
          "failureMode": "FAIL_SCENARIO"
        }
      },
      {
        "nodeId": "set_hvac_temperature",
        "nodeType": "effect.execute",
        "capabilityId": "vehicle.hvac.target_temperature",
        "required": true,
        "timeoutMs": 5000,
        "maxAttempts": 2,
        "idempotencyKeyTemplate": "scene.cold.hvac_temperature",
        "compensationNodeId": "",
        "policy": {
          "policyId": "policy.hvac.temperature.v1",
          "policyVersion": 1,
          "riskClass": "LOW",
          "drivingPolicy": "ANY",
          "approvalRequired": false,
          "failureMode": "FAIL_SCENARIO"
        }
      },
      {
        "nodeId": "set_seat_heating",
        "nodeType": "effect.execute",
        "capabilityId": "vehicle.seat.heating",
        "required": false,
        "timeoutMs": 5000,
        "maxAttempts": 2,
        "idempotencyKeyTemplate": "scene.cold.seat_heating",
        "compensationNodeId": "",
        "policy": {
          "policyId": "policy.seat.heating.v1",
          "policyVersion": 1,
          "riskClass": "MEDIUM",
          "drivingPolicy": "ANY",
          "approvalRequired": false,
          "failureMode": "SKIP_OPTIONAL"
        }
      },
      {
        "nodeId": "verify_hvac_power",
        "nodeType": "effect.verify",
        "capabilityId": "vehicle.hvac.power",
        "required": true,
        "timeoutMs": 5000,
        "maxAttempts": 1,
        "idempotencyKeyTemplate": "scene.cold.verify_hvac_power",
        "compensationNodeId": "",
        "policy": {
          "policyId": "policy.effect.verify.v1",
          "policyVersion": 1,
          "riskClass": "LOW",
          "drivingPolicy": "ANY",
          "approvalRequired": false,
          "failureMode": "FAIL_SCENARIO"
        }
      },
      {
        "nodeId": "verify_hvac_temperature",
        "nodeType": "effect.verify",
        "capabilityId": "vehicle.hvac.target_temperature",
        "required": true,
        "timeoutMs": 5000,
        "maxAttempts": 1,
        "idempotencyKeyTemplate": "scene.cold.verify_hvac_temperature",
        "compensationNodeId": "",
        "policy": {
          "policyId": "policy.effect.verify.v1",
          "policyVersion": 1,
          "riskClass": "LOW",
          "drivingPolicy": "ANY",
          "approvalRequired": false,
          "failureMode": "FAIL_SCENARIO"
        }
      },
      {
        "nodeId": "verify_seat_heating",
        "nodeType": "effect.verify",
        "capabilityId": "vehicle.seat.heating",
        "required": false,
        "timeoutMs": 5000,
        "maxAttempts": 1,
        "idempotencyKeyTemplate": "scene.cold.verify_seat_heating",
        "compensationNodeId": "",
        "policy": {
          "policyId": "policy.effect.verify.v1",
          "policyVersion": 1,
          "riskClass": "MEDIUM",
          "drivingPolicy": "ANY",
          "approvalRequired": false,
          "failureMode": "SKIP_OPTIONAL"
        }
      },
      {
        "nodeId": "render_summary",
        "nodeType": "summary.render",
        "capabilityId": "",
        "required": true,
        "timeoutMs": 1000,
        "maxAttempts": 1,
        "idempotencyKeyTemplate": "",
        "compensationNodeId": "",
        "policy": {
          "policyId": "policy.summary.render.v1",
          "policyVersion": 1,
          "riskClass": "LOW",
          "drivingPolicy": "ANY",
          "approvalRequired": false,
          "failureMode": "FAIL_SCENARIO"
        }
      }
    ],
    "dependencies": [
      {"prerequisiteNodeId": "capture_context", "dependentNodeId": "evaluate_policy", "condition": "ON_SUCCESS"},
      {"prerequisiteNodeId": "evaluate_policy", "dependentNodeId": "set_hvac_power", "condition": "ON_SUCCESS"},
      {"prerequisiteNodeId": "evaluate_policy", "dependentNodeId": "set_hvac_temperature", "condition": "ON_SUCCESS"},
      {"prerequisiteNodeId": "evaluate_policy", "dependentNodeId": "set_seat_heating", "condition": "ON_SUCCESS"},
      {"prerequisiteNodeId": "set_hvac_power", "dependentNodeId": "verify_hvac_power", "condition": "ON_SUCCESS"},
      {"prerequisiteNodeId": "set_hvac_temperature", "dependentNodeId": "verify_hvac_temperature", "condition": "ON_SUCCESS"},
      {"prerequisiteNodeId": "set_seat_heating", "dependentNodeId": "verify_seat_heating", "condition": "ON_SUCCESS"},
      {"prerequisiteNodeId": "verify_hvac_power", "dependentNodeId": "render_summary", "condition": "ON_TERMINAL"},
      {"prerequisiteNodeId": "verify_hvac_temperature", "dependentNodeId": "render_summary", "condition": "ON_TERMINAL"},
      {"prerequisiteNodeId": "verify_seat_heating", "dependentNodeId": "render_summary", "condition": "ON_TERMINAL"}
    ]
  },
  "fallback": {
    "mode": "DEGRADED_OPTIONAL_ONLY",
    "messageKey": "scenario.cold.partial",
    "optionalNodeIds": ["set_seat_heating", "verify_seat_heating"]
  },
  "ui": {
    "displayKey": "scenario.cold.title",
    "descriptionKey": "scenario.cold.description",
    "iconKey": "scenario.icon.climate",
    "sortOrder": 10
  }
}
