{
  "schemaVersion": 1,
  "scenarioId": "scene.rest.nap.v1",
  "version": 1,
  "supportedSources": ["HMI_BUTTON", "VOICE", "API"],
  "supportedZones": ["ROW1_DRIVER", "ROW1_PASSENGER"],
  "contextPolicyId": "context.seat-recline.v1",
  "requiredContext": [
    "Vehicle.Speed",
    "Vehicle.Powertrain.Transmission.CurrentGear",
    "Vehicle.Chassis.ParkingBrake.IsEngaged",
    "Vehicle.Cabin.Seat.IsOccupied",
    "Vehicle.Cabin.Seat.IsBelted",
    "Vehicle.Cabin.Seat.Position.Recline"
  ],
  "optionalContext": [
    "Vehicle.Cabin.HVAC.IsAirConditioningActive",
    "Vehicle.Cabin.HVAC.AmbientAirTemperature"
  ],
  "requiredCapabilities": [
    "vehicle.hvac.power",
    "vehicle.hvac.target_temperature",
    "vehicle.seat.recline"
  ],
  "optionalCapabilities": ["media.playback"],
  "riskClass": "HIGH",
  "planTemplate": {
    "nodes": [
      {
        "nodeId": "capture_context",
        "nodeType": "context.capture",
        "capabilityId": "",
        "required": true,
        "timeoutMs": 1000,
        "maxAttempts": 1,
        "idempotencyKeyTemplate": "",
        "compensationNodeId": "",
        "policy": {"policyId": "policy.context.capture.v1", "policyVersion": 1, "riskClass": "LOW", "drivingPolicy": "ANY", "approvalRequired": false, "failureMode": "FAIL_SCENARIO"}
      },
      {
        "nodeId": "evaluate_policy",
        "nodeType": "policy.evaluate",
        "capabilityId": "",
        "required": true,
        "timeoutMs": 1000,
        "maxAttempts": 1,
        "idempotencyKeyTemplate": "",
        "compensationNodeId": "",
        "policy": {"policyId": "policy.rest.nap.v1", "policyVersion": 1, "riskClass": "LOW", "drivingPolicy": "PARKED_ONLY", "approvalRequired": false, "failureMode": "FAIL_SCENARIO"}
      },
      {
        "nodeId": "request_seat_approval",
        "nodeType": "approval.interrupt",
        "capabilityId": "",
        "required": true,
        "timeoutMs": 120000,
        "maxAttempts": 1,
        "idempotencyKeyTemplate": "",
        "compensationNodeId": "",
        "policy": {"policyId": "policy.seat.recline.approval.v1", "policyVersion": 1, "riskClass": "HIGH", "drivingPolicy": "PARKED_ONLY", "approvalRequired": true, "failureMode": "FAIL_SCENARIO"}
      },
      {
        "nodeId": "set_hvac_power",
        "nodeType": "effect.execute",
        "capabilityId": "vehicle.hvac.power",
        "required": true,
        "timeoutMs": 5000,
        "maxAttempts": 2,
        "idempotencyKeyTemplate": "scene.rest.hvac_power",
        "compensationNodeId": "",
        "policy": {"policyId": "policy.hvac.power.v1", "policyVersion": 1, "riskClass": "LOW", "drivingPolicy": "PARKED_ONLY", "approvalRequired": false, "failureMode": "FAIL_SCENARIO"}
      },
      {
        "nodeId": "set_hvac_temperature",
        "nodeType": "effect.execute",
        "capabilityId": "vehicle.hvac.target_temperature",
        "required": true,
        "timeoutMs": 5000,
        "maxAttempts": 2,
        "idempotencyKeyTemplate": "scene.rest.hvac_temperature",
        "compensationNodeId": "",
        "policy": {"policyId": "policy.hvac.temperature.v1", "policyVersion": 1, "riskClass": "LOW", "drivingPolicy": "PARKED_ONLY", "approvalRequired": false, "failureMode": "FAIL_SCENARIO"}
      },
      {
        "nodeId": "set_seat_recline",
        "nodeType": "effect.execute",
        "capabilityId": "vehicle.seat.recline",
        "required": true,
        "timeoutMs": 8000,
        "maxAttempts": 1,
        "idempotencyKeyTemplate": "scene.rest.seat_recline",
        "compensationNodeId": "",
        "policy": {"policyId": "policy.seat.recline.v1", "policyVersion": 1, "riskClass": "HIGH", "drivingPolicy": "PARKED_ONLY", "approvalRequired": true, "failureMode": "FAIL_SCENARIO"}
      },
      {
        "nodeId": "pause_media",
        "nodeType": "effect.execute",
        "capabilityId": "media.playback",
        "required": false,
        "timeoutMs": 3000,
        "maxAttempts": 2,
        "idempotencyKeyTemplate": "scene.rest.media_pause",
        "compensationNodeId": "",
        "policy": {"policyId": "policy.media.playback.v1", "policyVersion": 1, "riskClass": "LOW", "drivingPolicy": "PARKED_ONLY", "approvalRequired": false, "failureMode": "SKIP_OPTIONAL"}
      },
      {
        "nodeId": "verify_hvac_power",
        "nodeType": "effect.verify",
        "capabilityId": "vehicle.hvac.power",
        "required": true,
        "timeoutMs": 5000,
        "maxAttempts": 1,
        "idempotencyKeyTemplate": "scene.rest.verify_hvac_power",
        "compensationNodeId": "",
        "policy": {"policyId": "policy.effect.verify.v1", "policyVersion": 1, "riskClass": "LOW", "drivingPolicy": "PARKED_ONLY", "approvalRequired": false, "failureMode": "FAIL_SCENARIO"}
      },
      {
        "nodeId": "verify_hvac_temperature",
        "nodeType": "effect.verify",
        "capabilityId": "vehicle.hvac.target_temperature",
        "required": true,
        "timeoutMs": 5000,
        "maxAttempts": 1,
        "idempotencyKeyTemplate": "scene.rest.verify_hvac_temperature",
        "compensationNodeId": "",
        "policy": {"policyId": "policy.effect.verify.v1", "policyVersion": 1, "riskClass": "LOW", "drivingPolicy": "PARKED_ONLY", "approvalRequired": false, "failureMode": "FAIL_SCENARIO"}
      },
      {
        "nodeId": "verify_seat_recline",
        "nodeType": "effect.verify",
        "capabilityId": "vehicle.seat.recline",
        "required": true,
        "timeoutMs": 8000,
        "maxAttempts": 1,
        "idempotencyKeyTemplate": "scene.rest.verify_seat_recline",
        "compensationNodeId": "",
        "policy": {"policyId": "policy.effect.verify.v1", "policyVersion": 1, "riskClass": "HIGH", "drivingPolicy": "PARKED_ONLY", "approvalRequired": true, "failureMode": "FAIL_SCENARIO"}
      },
      {
        "nodeId": "render_summary",
        "nodeType": "summary.render",
        "capabilityId": "",
        "required": true,
        "timeoutMs": 1000,
        "maxAttempts": 1,
        "idempotencyKeyTemplate": "",
        "compensationNodeId": "",
        "policy": {"policyId": "policy.summary.render.v1", "policyVersion": 1, "riskClass": "LOW", "drivingPolicy": "PARKED_ONLY", "approvalRequired": false, "failureMode": "FAIL_SCENARIO"}
      }
    ],
    "dependencies": [
      {"prerequisiteNodeId": "capture_context", "dependentNodeId": "evaluate_policy", "condition": "ON_SUCCESS"},
      {"prerequisiteNodeId": "evaluate_policy", "dependentNodeId": "request_seat_approval", "condition": "ON_SUCCESS"},
      {"prerequisiteNodeId": "evaluate_policy", "dependentNodeId": "set_hvac_power", "condition": "ON_SUCCESS"},
      {"prerequisiteNodeId": "evaluate_policy", "dependentNodeId": "set_hvac_temperature", "condition": "ON_SUCCESS"},
      {"prerequisiteNodeId": "evaluate_policy", "dependentNodeId": "pause_media", "condition": "ON_SUCCESS"},
      {"prerequisiteNodeId": "request_seat_approval", "dependentNodeId": "set_seat_recline", "condition": "ON_SUCCESS"},
      {"prerequisiteNodeId": "set_hvac_power", "dependentNodeId": "verify_hvac_power", "condition": "ON_SUCCESS"},
      {"prerequisiteNodeId": "set_hvac_temperature", "dependentNodeId": "verify_hvac_temperature", "condition": "ON_SUCCESS"},
      {"prerequisiteNodeId": "set_seat_recline", "dependentNodeId": "verify_seat_recline", "condition": "ON_SUCCESS"},
      {"prerequisiteNodeId": "verify_hvac_power", "dependentNodeId": "render_summary", "condition": "ON_TERMINAL"},
      {"prerequisiteNodeId": "verify_hvac_temperature", "dependentNodeId": "render_summary", "condition": "ON_TERMINAL"},
      {"prerequisiteNodeId": "verify_seat_recline", "dependentNodeId": "render_summary", "condition": "ON_TERMINAL"},
      {"prerequisiteNodeId": "pause_media", "dependentNodeId": "render_summary", "condition": "ON_TERMINAL"}
    ]
  },
  "fallback": {
    "mode": "DEGRADED_OPTIONAL_ONLY",
    "messageKey": "scenario.rest.partial",
    "optionalNodeIds": ["pause_media"]
  },
  "ui": {
    "displayKey": "scenario.rest.title",
    "descriptionKey": "scenario.rest.description",
    "iconKey": "scenario.icon.rest",
    "sortOrder": 30
  }
}
